{
  "schema_version": "v1.0.0",
  "field_id": "brightlands_f01",
  "trap_code": "T12",
  "capture_date": "2026-04-06",
  "capture_time": "08:30:00",
  "timezone": "Europe/Berlin",
  "device_id": "cam-west-01",
  "operator_id": "tech-lfa",
  "notes": "Morning capture after light rain.",
  "gps": {
    "lat": 50.8612,
    "lon": 5.6921
  },
  "weather": {
    "temperature_c": 11.2,
    "humidity_pct": 84.0,
    "rain_mm": 0.8
  }
}
